title,author,year,DOI,pubid,ucol
"emissions of n2o and nh3, and nitrogen leaching from direct seeded rice under different tillage practices in central china",zhang,2011,10.1016/j.agee.2010.11.023,mondal2020,zhang2011
effect of tillage measures on the soil potassium contents and yields in the double sequence rotation system,zhang,2012,,lu2020,zhang2012
effects of conservation tillage on soil aggregation and aggregate binding agents in black soil of northeast china,zhang,2012,10.1016/j.still.2012.06.007,mondal2020,zhang2012
effects of tillage and residue management on soil nematode communities in north china,zhang,2012,10.1016/j.ecolind.2011.05.009,ranaivoson2017,zhang2012
soil microbial community dynamics over a maize (zea mays l,zhang,2012,10.1016/j.still.2012.05.011,mondal2020,zhang2012
comparison of three tillage systems in the wheat-maize system on carbon sequestration in the north china plain,zhang,2013,10.1016/j.jclepro.2013.04.033,mondal2020,zhang2013
effects of the alternate years deep plowing on leaf senescence after anthesis and grain yield of summer maize,zhang,2013,,lu2020,zhang2013
emissions of ch4 and n2o under different tillage systems from double-cropped paddy fields in southern china,zhang,2013,10.1371/journal.pone.0065277,mondal2020,zhang2013
"application of different management measures to reduce runoff losses of nitrogen, phosphorus and copper from orchard in dense river network plain",zhang,2014,10.3969/j.issn.1002-6819.2014.02.017,liu2021,zhang2014
"changes in soil properties, yield and trace gas emission from a paddy after biochar amendment in two consecutive rice growing cycles",zhang,2014,,omondi2016,zhang2014
"effects of drip irrigation with saline water on cotton yield, soil physical and chemical properties, and soil n2o emission",zhang,2014,,cheng2021c,zhang2014
a one-year short-term biochar application improved carbon accumulation in large macroaggregate fractions,zhang,2015,10.1016/j.catena.2014.12.009,omondi2016,zhang2015
"cinnamon fluvo-acqic soil fertility evolutiion under long-term fertilizing, chapter 9 in the book ""china soil fertility evolution""",zhang,2015,,bai2018,zhang2015
conservation tillage positively influences the microflora and microfauna in the black soil of northeast china,zhang,2015,10.1016/j.still.2015.01.001,mondal2020,zhang2015
integrative effects of soil tillage and straw management on crop yields and greenhouse gas emissions in a rice–wheat cropping system,zhang,2015,10.1016/j.eja.2014.11.005,lu2020,zhang2015
biochar effect on water evaporation and hydraulic conductivity in sandy soil,zhang,2016,10.1016/s1002-0160(15)60041-8,rabbi2021,zhang2016
biochar helps enhance maize productivity and reduce greenhouse gas emissions under balanced fertilization in a rainfed low fertility inceptisol,zhang,2016,10.1016/j.chemosphere.2015.04.088,omondi2016,zhang2016
"coupling water and fertilizer effects on cotton yield, nitrogen accumulation and nitrogen use efficiency",zhang,2016,,cheng2021b,zhang2016
effect of conservation farming practices on soil organic matter and stratification in a mono-cropping system of northern china,zhang,2016,10.1016/j.still.2015.10.008,li2020,zhang2016
effects of conservation tillage on physical and chemical  characteristics under a pea-wheat rotation system in the loess plateau,zhang,2016,,li2020,zhang2016
effects of conservation tillage on soil physical properties and corn yield in sandy soil,zhang,2016,,li2020,zhang2016
"effects of deficit irrigation and plant density on the growth, yield and fiber quality of irrigated cotton",zhang,2016,10.1016/j.fcr.2016.06.003,cheng2021b,zhang2016
influence of returning corn stalks to field under different soil moisture contents on root growth and water use efficiency of wheat (triticum aestivum l.),zhang,2016,,yu2020,zhang2016
soil water balance and water use efficiency of dryland wheat in different precipitation years in response to green manure approach,zhang,2016,10.1038/srep26856,jian2020,zhang2016
benefit evaluation on typical soil and water conservation measures in citrus orchard on red soil slope,zhang,2017,,liu2021,zhang2017
effects of ridging and mulching combined practices on proso millet growth and yield in semi-arid regions of china,zhang,2017,10.1016/j.fcr.2017.06.015,lu2020,zhang2017
"effects of straw and biochar amendments on aggregate stability, soil organic carbon, and enzyme activities in the loess plateau, china",zhang,2017,10.1007/s11356-017-8505-8,islam2021,zhang2017
effects of tillage and residue managements on organic c accumulation and soil aggregation in a sandy loam soil of the north china plain,zhang,2017,10.1016/j.catena.2017.04.012,li2020,zhang2017
"effects of water stress on processing tomatoes yield, quality and water use efficiency with plastic mulched drip irrigation in sandy soil of the hetao irrigation district",zhang,2017,10.1016/j.agwat.2016.07.022,lu2019,zhang2017
effects of biochar application on irrigation tillage sandy soil aggregate and nutrition content,zhang,2018,,islam2021,zhang2018
"effects of mixed use of biochar and polyacrylamide on soil moisture, the growth, physiological characteristics and yield of maize",zhang,2018,,gao2020,zhang2018
effects of maize straw and its biochar application on organic and humic carbon in water-stable aggregates of a mollisol in northeast china: a five-year field experiment,zhang,2019,10.1016/j.still.2019.02.014,islam2021,zhang2019
improvement of physical and hydraulic properties of desert soil with amendment of different biochars,zhang,2019,10.1007/s11368-019-02293-8,islam2021,zhang2019
conservation tillage practices reduce nitrogen losses in the sloping upland of the three gorges reservoir area: no-till is better than mulch-till,zhang,2020,10.1016/j.agee.2020.107003,liu2021,zhang2020
"effects of six-year biochar amendment on soil aggregation, crop growth, and nitrogen and phosphorus use efficiencies in a rice-wheat rotation",zhang,2020,10.1016/j.jclepro.2019.118435,islam2021,zhang2020
effect of different tillages on soil physical properties of dryland wheat field in the loess plateau,zhao,2009,,li2020,zhao2009
soil and water conservation effects of protective tillage measures on sloping farmland,zhao,2009,,xiong2018,zhao2009
"comparisons of yield, water use efficiency, and soil microbial biomass as affected by the system of rice intensification",zhao,2010,10.1080/00103620903360247,du2018,zhao2010
effect of different cultivation measures on activity and bound forms of organic carbon in lou soil,zhao,2010,,li2020,zhao2010
"plateau red soil fertility evolutiion under long-term fertilizing. chapter 30 in the book ""china soil fertility evolution""",zhao,2015,,bai2018,zhao2015
stratification and storage of soil organic carbon and nitrogen as affected by tillage practices in the north china plain,zhao,2015,10.1371/journal.pone.0128873,mondal2020,zhao2015
effect of vegetation changes on soil erosion on the loess plateau,zheng,2006,10.1016/s1002-0160(06)60071-4,xiong2018,zheng2006
soil conservation benefit analysis for citrus orchard in the reservoir basin of three gorges,zheng,2006,,xiong2018,zheng2006
"effect of regulated deficit irrigation on the plant growth, yield and quality of processing tomato under border irrigation in hetao irrigation district",zheng,2016,,lu2019,zheng2016
improving yield and water use efficiency of apple trees through intercrop-mulch of crown vetch (coronilla varia l.) combined with different fertilizer treatments in the loess plateau,zheng,2016,10.5424/sjar/2016144-9575,jian2020,zheng2016
limited irrigation for improving water use efficiency of winter wheat in the guanzhong plain of northwest china,zheng,2016,10.13031/trans.59.11810,yu2020,zheng2016
micromorphological analysis of soil structure under no tillage management in the black soil zone of northeast china,zhou,2009,10.1007/s11629-009-1034-2,mondal2020,zhou2009
runoff and sediment yield on slope land in initial stages of conversion of cropland to forest in northwestern hunan province,zhou,2009,,xiong2018,zhou2009
biochar amendment of chromium-polluted paddy soil suppresses greenhouse gas emissions and decreases chromium uptake by rice grain,zhou,2019,10.1007/s11368-018-2170-5,islam2021,zhou2019
biochar enhances soil hydraulic function but not soil aggregation in a sandy loam,zhou,2019,10.1111/ejss.12732,islam2021,zhou2019
effects of waste application on the distribution and stability of soil aggregates in the paddy field of fuzhou plain,zhu,2016,,islam2021,zhu2016
"non-leguminous winter cover crop and nitrogen rate in relation to double rice grain yield and nitrogen uptake in dongting lake plain, hunan province, china",zhu,2016,10.1016/s2095-3119(16)61331-x,jian2020,zhu2016
benefits of plant strips for sustainable mountain agriculture,zuazo,2008,10.1051/agro:2008020,liu2021,zuazo2008
harvest intensity of aromatic shrubs vs. soil erosion: an equilibrium for sustainable agriculture (se spain),zuazo,2008,10.1016/j.catena.2007.09.006,lee2019,zuazo2008
