title,author,year,DOI,pubid,ucol
"tillage, cover crops, and nitrogen fertilization effects on soil nitrogen and cotton and sorghum yields",sainju,2006,10.2134/agronj2004.0213,jian2020,sainju2006
"accumulation and crop uptake of soil mineral nitrogen as influenced by tillage, cover crops, and nitrogen fertilization",sainju,2007,10.2134/agronj2006.0177,ranaivoson2017,sainju2007
cover crop effect on soil carbon fractions under conservation tillage cotton,sainju,2007,10.1016/j.still.2007.06.006,jian2020,sainju2007
dryland plant biomass and soil carbon and nitrogen fractions on transient land as influenced by tillage and crop rotation,sainju,2007,10.1016/j.still.2006.06.003,jian2020,sainju2007
long-term tillage and cropping sequence effects on dryland residue and soil carbon fractions,sainju,2007,10.2136/ssaj2006.0433,mondal2020,sainju2007
dryland soil carbon and nitrogen after thirty years of tillage and cropping sequence combination,sainju,2015,10.2134/agronj15.0106,mondal2020,sainju2015
dryland soil chemical properties and crop yields affected by long-term tillage and cropping sequence.  ,sainju,2015,10.1186/s40064-015-1122-4,li2020,sainju2015
effects of grazing intensity and prescribed fire on soil physical and hydrological properties and pasture yield in the savanna woodlands of burkina faso,savadogo,2007,10.1016/j.agee.2006.05.002,delonge2018,savadogo2007
fuel and fire characteristics in savanna - woodland of west africa in relation to grazing and dominant grass type,savadogo,2007,10.1071/wf07011,byrnes2018,savadogo2007
long-term soil management effects on crop yields and soil quality in a dryland alfisol,sharma,2005,10.1016/j.still.2004.08.002,li2020,sharma2005
"tillage effects on soil physical properties and performance of rice-wheat-cropping system under shallow water table conditions of tarai, northern india",sharma,2005,10.1016/j.eja.2005.01.003,basche2019,sharma2005
twenty years of conservation tillage research in subarctic alaska - ii,sharratt,2006,10.1016/j.still.2006.01.010,mondal2020,sharratt2006
twenty years of tillage research in subarctic alaska,sharratt,2006,10.1016/j.still.2005.11.006,basche2019,sharratt2006
an assessment of the soil microbial status after 17 years of tillage and mineral p fertilization management,shi,2012,10.1016/j.apsoil.2012.07.004,mondal2020,shi2012
contribution of winter soil respiration to annual soil co2 emission in a mollisol under different tillage practices in northeast china,shi,2012,10.1029/2011gb004054,mondal2020,shi2012
impact of ridge tillage on soil organic carbon and selected physical properties of a clay loam in southwestern ontario,shi,2012,10.1016/j.still.2012.01.003,mondal2020,shi2012
compensation effect of nitrogen fertilizer on photosynthetic characteristics and yield during cotton flowering boll-setting stage under non-sufficient drip irrigation,shi,2018,10.3724/sp.j.1006.2018.01196,cheng2021b,shi2018
effects of biochar and water retaining agent on the growth of anthurium scherzerianum schott,shi,2018,,gao2020,shi2018
long-term effects of improved legume fallows on soil invertebrate macrofauna and maize yield in eastern zambia,sileshi,2006,10.1016/j.agee.2005.12.010,jian2020,sileshi2006
variation in macrofaunal communities under contrasting land use systems in eastern zambia,sileshi,2006,10.1016/j.apsoil.2005.09.003,jian2020,sileshi2006
"conservation tillage and manure effect on soil aggregation, yield and energy requirement for wheat (triticum aestivum) in vertisols",singh,2014,10.13031/aim.20141912652,mondal2020,singh2014
impact of long-term zero till wheat on soil physical properties and wheat productivity under rice-wheat cropping system,singh,2014,10.1016/j.still.2014.03.002,mondal2020,singh2014
effect of growth stage based irrigation on soil water extraction and water use efficiency of spring safflower cultivars,singh,2016,10.1016/j.agwat.2016.08.023,yu2021,singh2016
"soil physical properties, yield trends and economics after five years of conservation agriculture based rice-maize system in north-western india",singh,2016,10.1016/j.still.2015.08.001,basche2019,singh2016
long-term impacts of infrequent  biosolids applications on chemical and microbial properties of a semi-arid rangeland soil,sullivan,2006,10.1007/s00374-005-0023-z,gravuer2018,sullivan2006
parallel shifts in plant and soil microbial  communities in response to biosolids in a semi-arid grassland,sullivan,2006,10.1016/j.soilbio.2005.05.018,gravuer2018,sullivan2006
effects of different tillage systems on soil hydrothermal regimes in rain-fed field of inner mongolia,sun,2010,10.1016/j.still.2017.11.011,li2020,sun2010
effects of tillage mode on soil erosion of rain-fed cropland in inner mongolia,sun,2010,,sun2015,sun2010
distribution of soil carbon and microbial biomass in arable soils under different tillage regimes,sun,2011,10.1007/s11104-010-0459-2,mondal2020,sun2011
grazing depresses soil carbon storage through changing plant biomass and composition in a tibetan alpine meadow,sun,2011,10.17221/7/2011-pse,byrnes2018,sun2011
changes in soil organic carbon and its chemical fractions under different tillage practices on loess soils of the guanzhong plain in north-west china,sun,2013,10.1111/sum.12046,mondal2020,sun2013
direct and indirect short-term effects of biochar on physical characteristics of an arable sandy loam,sun,2013,10.1097/ss.0000000000000010,rabbi2021,sun2013
alternate partial root-zone drying irrigation improves fruit quality in tomatoes,sun,2014,10.17221/259/2013-hortsci,cheng2021a,sun2014
"biochars improve aggregate stability, water retention, and pore-space properties of clayey soil",sun,2014,10.1002/jpln.201200639,omondi2016,sun2014
effects of different biochar rates on physical and chemical properties of red soil and maize growth,sun,2014,,omondi2016,sun2014
no tillage combined with crop rotation improves soil microbial community composition and metabolic activity,sun,2016,10.1007/s11356-015-5812-9,li2020,sun2016
study on application effect of different soil and water conservation measures in gannan navel orange orchard,sun,2016,10.3969/j.issn.1000-0941.2016.08.005,liu2021,sun2016
effect of biochar amendment on water infiltration in a coastal saline soil,sun,2018,10.1007/s11368-018-2001-8,rabbi2021,sun2018
effects of biochar levels on winter wheat yield and water-use efficiency in loess plateau,sun,2018,,gao2020,sun2018
effects of biochar on stability of soil aggregates and active organic carbon in black soil,sun,2018,,islam2021,sun2018
"physico-chemical indicators and microarthropod communities as influenced by no-till, conventional tillage and nitrogen fertilisation after four years of continuous maize",tabaglio,2009,10.1016/j.still.2009.06.006,mondal2020,tabaglio2009
"soil quality indicators as influenced by no-tillage, conventional tillage and nitrogen fertilization after 3 years of continuous maize in the po valley",tabaglio,2009,,mondal2020,tabaglio2009
effect of grazing on plant attributes and hydrological properties in the sloping lands of the east african highlands,taddese,2002,10.1007/s00267-002-2727-2,delonge2018,taddese2002
"impact of grazing on plant species richness, plant biomass, plant attribute, and soil physical and hydrological properties of vertisol in east african highlands",taddese,2002,10.1007/s00267-001-0014-2,delonge2018,taddese2002
"biochar application to a fertile sandy clay loam in boreal conditions: effects on soil properties and yield formation of wheat, turnip rape and faba bean",tammeorg,2014,10.1007/s11104-013-1851-5,omondi2016,tammeorg2014
short-term effects of biochar on soil properties and wheat yield formation with meat bone meal and inorganic fertiliser on a boreal loamy sand,tammeorg,2014,10.1016/j.agee.2014.01.007,edeh2020,tammeorg2014
biomass allocation and yield formation of cotton under partial rootzone irrigation in arid zone,tang,2010,10.1007/s11104-010-0537-5,cheng2021a,tang2010
"partial rootzone irrigation increases water use efficiency, maintains yield and enhances economic profit of cotton in arid area",tang,2010,10.1016/j.agwat.2010.05.006,cheng2021a,tang2010
n2o and ch4 emissions from a fallow-wheat rotation with low n input in conservation and conventional tillage under a mediterranean agroecosystem,tellez-rio,2015,10.1016/j.scitotenv.2014.11.041,lee2019,tellez-rio2015
nitrous oxide and methane emissions from a vetch cropping season are changed by long-term tillage practices in a mediterranean agroecosystem,tellez-rio,2015,10.1007/s00374-014-0952-5,mondal2020,tellez-rio2015
aggregate c depletion by plowing and its restoration by diverse biomass-c inputs under no-till in sub-tropical and tropical regions of brazil,tivet,2013,10.1016/j.still.2012.09.004,mondal2020,tivet2013
soil organic carbon fraction losses upon continuous plow-based tillage and its restoration by diverse biomass-c inputs under no-till in sub-tropical and tropical regions of brazil,tivet,2013,10.1016/j.geoderma.2013.06.008,mondal2020,tivet2013
conservation tillage to effectively reduce interrill erodibility of highly-weathered ultisols,truman,2009,10.2489/jswc.64.4.265,sun2015,truman2009
improved water capture and erosion reduction through furrow diking,truman,2009,10.1016/j.agwat.2008.12.002,mhazo2016,truman2009
long-term tillage effects on soil carbon storage and carbon dioxide emissions in continuous corn cropping system from an alfisol in ohio,ussiri,2009,10.1016/j.still.2008.11.008,mondal2020,ussiri2009
nitrous oxide and methane emissions from long-term tillage under a continuous corn cropping system in ohio,ussiri,2009,10.1016/j.still.2009.03.001,mondal2020,ussiri2009
benefits of biological measures to the soil and water conservation in gannan mountain area,wang,2008,,xiong2018,wang2008
"modeling the impacts of soil management practices on runoff, sediment yield, maize productivity, and soil organic carbon using apex",wang,2008,10.1016/j.still.2008.07.014,mhazo2016,wang2008
"soil chemical properties and microbial biomass after 16 years of no-tillage farming on the loess plateau, china",wang,2008,10.1016/j.geoderma.2008.01.003,li2020,wang2008
traffic and tillage effects on runoff and soil loss on the loess plateau of northern china,wang,2008,10.1071/sr08063,sun2015,wang2008
effects of alley crop planting on soil and nutrient losses in the citrus orchards of the three gorges region,wang,2010,10.1016/j.still.2010.08.012,liu2021,wang2010
effects of water and phosphorus on yield and water use efficiency of cotton with drip irrigation under mulch,wang,2010,,cheng2021b,wang2010
characteristics of runoff and sediment production from orchard plots under different mixed and relay plantations in hilly area with red soils,wang,2011,10.13870/j.cnki.stbcxb.2011.04.025,liu2021,wang2011
effect of conservation tillage on wheat yield and soil physicochemical properties in the south of loess plateau,wang,2011,,li2020,wang2011
effects of long-term zero-tillage on soil physiochemical properties and enzyme activities in cinnamon soil,wang,2011,,li2020,wang2011
long-term impact of farming practices on soil organic carbon and nitrogen pools and microbial biomass and activity,wang,2011,10.1016/j.still.2011.08.002,bai2018,wang2011
surface soil phosphorus and phosphatase activities affected by tillage and crop residue input amounts,wang,2011,,ranaivoson2017,wang2011
effects of application of potassium fertilizer and straw returning on crop yields and soil potassium balance in low- yielding fields,wang,2012,,lu2020,wang2012
effects of coupling of precise straw-return and nitrogen fertilizer on photosynthetic characteristics after anthesis and yield of winter wheat,wang,2012,,lu2020,wang2012
effects of tillage and residue management on soil microbial communities in north china,wang,2012,10.17221/416/2011-pse,mondal2020,wang2012
"effects of tillage mangement on microbiological characteristics related to transformation of carbon, nitrogen, and phosphorus in luvo-aquic soil",wang,2013,10.3724/sp.j.1145.2013.00868,li2020,wang2013
impact of drip and level-basin irrigation on growth and yield of winter wheat in the north china plain,wang,2013,10.1007/s00271-012-0384-7,yu2020,wang2013
study on the cotton-water-solute interactions under mulched drip irrigation with brackish water in an arid area,wang,2013,,cheng2021c,wang2013
brackish water irrigation of greenhouse tomato in non-cultivated land,wang,2014,,cheng2021c,wang2014
effect of regulated deficit irrigation on yield and water use efficiency of processing tomato (solanum lycopersicum),wang,2014,10.4028/www.scientific.net/amr.864-867.2009,lu2019,wang2014
effects of straw returning and plastic film mulching on dryland maize yield in northwest china,wang,2014,,lu2020,wang2014
effects of tillage and residue incorporation on composition and abundance of microbial communities of a fluvo-aquic soil,wang,2014,10.1016/j.ejsobi.2014.10.003,mondal2020,wang2014
impacts of 9 years of a new conservational agricultural management on soil organic carbon fractions,wang,2014,10.1016/j.still.2014.05.004,mondal2020,wang2014
planting pattern and irrigation effects on water-use efficiency of winter wheat,wang,2014,10.2135/cropsci2013.06.0363,yu2020,wang2014
dynamic response of soil moisture in navel orange orchard to rainfall and grass cover,wang,2015,10.13698/j.cnki.cn36-1037/c.2015.06.013,liu2021,wang2015
effects of water limitation on yield advantage and water use in wheat (triticum aestivum l.)/maize (zea mays l.) strip intercropping,wang,2015,10.1016/j.eja.2015.09.007,yu2021,wang2015
ghg mitigation potential of different grazing strategies in the united states southern great plains,wang,2015,10.3390/su71013500,byrnes2018,wang2015
impact of irrigation volume and water salinity on winter wheat productivity and soil salinity distribution,wang,2015,10.1016/j.agwat.2014.10.027,cheng2021c,wang2015
"lime concretion black soil fertility evolutiion under long-term fertilizing. chapter 26 in the book ""china soil fertility evolution""",wang,2015,,bai2018,wang2015
"paddy soil fertility evolutiion under long-term fertilizing. chapter 43 in the book ""china soil fertility evolution""",wang,2015,,bai2018,wang2015
"red upland soil fertility evolutiion under long-term fertilizing for wheat-maize rotation. chapter 28 in the book ""china soil fertility evolution""",wang,2015,,bai2018,wang2015
soil infiltration characteristics in agroforestry systems and their relationships with the temporal distribution of rainfall on the loess plateau in china,wang,2015,10.1371/journal.pone.0124767,basche2019,wang2015
"yellow upland soil fertility evolutiion under long-term fertilizing. chapter 29 in the book ""china soil fertility evolution""",wang,2015,,bai2018,wang2015
characteristics of runoff and sediment production in navel orange orchard under natural rainfall,wang,2016,10.13698/j.cnki.cn36-1346/c.2016.06.021,liu2021,wang2016
conservation tillage increases soil bacterial diversity in the dryland of northern china,wang,2016,10.1007/s13593-016-0366-x,li2020,wang2016
effect of different returning method of straw to soil on soil chemical property and soybean yield,wang,2016,,lu2020,wang2016
"effects of long-term straw mulching on soil organic carbon, nitrogen and moisture and spring maize yield on rain-fed croplands under different patterns of soil tillage practice",wang,2016,,li2020,wang2016
influence of biochar on greenhouse gases emissions and physico-chemical properties of loess soil,wang,2016,,islam2021,wang2016
preliminary research on soil erosion and derived non-point pollution of navel orange orchard,wang,2016,10.14067/j.cnki.1673-923x.2015.05.013,liu2021,wang2016
biochar additions can enhance soil structure and the physical stabilization of c in aggregates,wang,2017,10.1016/j.geoderma.2017.05.027,islam2021,wang2017
effects of organic fertilizer combined with biochar on soil moisture and water use efficiency in vegetable field,wang,2017,,gao2020,wang2017
nitrogen fertilization improved water-use efficiency of winter wheat through increasing water use during vegetative rather than grain filling,wang,2017,10.1016/j.agwat.2017.11.010,yu2021,wang2017
"coupling effects of water and fertilizer on yield, water and fertilizer use efficiency of drip-fertigated cotton in northern xinjiang, china",wang,2018,10.1016/j.fcr.2018.02.002,cheng2021b,wang2018
"effects of biochar amendment, co2 elevation and drought on leaf gas exchange, biomass production and water use efficiency in maize",wang,2018,,gao2020,wang2018
effects of biochar on the stability of aggregates in aeolian soil,wang,2018,10.4067/s0718-95162013005000078,islam2021,wang2018
effects of straw returning on yield and soil aggregates composition and organic carbon distribution,wang,2018,,islam2021,wang2018
"evapotranspiration, crop coefficient and yield for drip-irrigated winter wheat with straw mulching in north china plain",wang,2018,10.1016/j.fcr.2017.05.010,lu2020,wang2018
"soil salinity, sodicity and cotton yield parameters under different drip irrigation regimes during saline wasteland reclamation",wang,2018,10.1016/j.agwat.2018.07.004,cheng2021b,wang2018
effect of combined application of biochar and straw onorganic carbon content in purple soil aggregates,wang,2019,,islam2021,wang2019
effects of alternate partial root-zone irrigation on the utilization and movement of nitrates in soil by tomato plants,wang,2019,10.1016/j.scienta.2018.08.006,cheng2021a,wang2019
effects of biochar addition on photosynthetic characteristics of sorghum sudanense in crude oil polluted soils,wang,2019,,gao2020,wang2019
effects of biochar on soil aggregate structure in greenhouse,wang,2019,10.1007/s11104-012-1250-3,islam2021,wang2019
impact of biochar on water retention of two agricultural soils: a multi-scale analysis,wang,2019,10.1016/j.geoderma.2019.01.012,edeh2020,wang2019
soil hydrologic response to number of pastures and stocking density under intensive rotation grazing,warren,1986,10.2307/3898757,delonge2018,warren1986
the influence of livestock trampling under intensive rotation grazing on soil hydrologic characteristics,warren,1986,10.2307/3898755,delonge2018,warren1986
impact of vegetative filter strips on herbicide loss in runoff from soybean (glycine max),webster,1996,10.1017/s0043174500094509,sun2015,webster1996
off-site runoff losses of metolachlor and metribuzin applied to differing soybean (glycine max) production systems,webster,1996,10.1017/s0890037x00040434,sun2015,webster1996
effects of tillages on soil organic carbon sequestration in north china plain,wei,2013,,li2020,wei2013
stable carbon isotope discrimination on water use efficiency of field tomato under furrow irrigation,wei,2013,,cheng2021a,wei2013
effect and comprehensive evaluation of biochar application mode on slope farmland in black soil region,wei,2018,,gao2020,wei2018
effects of different kinds of organic materials application on organic carbon and humus composition within different aggregate size fractions in a black soil,wei,2018,,islam2021,wei2018
aggregate stability in organically and conventionally farmed soils,williams,2009,10.1111/j.1475-2743.2009.00223.x,bai2018,williams2009
"comparison of runoff, soil erosion, and winter wheat yields from no-till and inversion tillage production systems in northeastern oregon",williams,2009,10.2489/jswc.64.1.43,mhazo2016,williams2009
crop species and tillage effects on carbon sequestration in subsurface soil,wright,2007,10.1097/ss.0b013e31802d11eb,mondal2020,wright2007
soil organic c and n distribution for wheat cropping systems after 20 years of conservation tillage in central texas,wright,2007,10.1016/j.agee.2006.11.011,mondal2020,wright2007
effect of drip irrigation and fertilizer application on water use efficiency and cotton yield in north of xinjiang,wu,2014,,cheng2021b,wu2014
effects of conservation tillage on soil physical properties of rainfed field of the loess plateau in central of gansu,wu,2014,,li2020,wu2014
greenhouse gas emissions from cotton field under different irrigation methods and fertilization regimes in arid northwestern china,wu,2014,,gao2020,wu2014
effects of different fertilization on the corn yield and soil enzyme activity in corn growth period,wu,2015,,lu2020,wu2015
"effects of saline water irrigation on tomato growth, qualtiy and yield under straw mulching",wu,2015,,cheng2021c,wu2015
"loess soil fertility evolutiion under long-term different tillage. chapter 17 in the book ""china soil fertility evolution""",wu,2015,,bai2018,wu2015
"altering surface soil dynamics with winter cover crops in a vegetable cropping system: impacts on yield, nitrate leaching, pests and management costs",wyland,1996,,jian2020,wyland1996
"winter cover crops in a vegetable cropping system: impacts on nitrate leaching, soil water, crop yield, pests and management costs",wyland,1996,10.1016/0167-8809(96)01048-1,shackelford2019,wyland1996
characteristics of the nitrogen and phosphorus loss in the runoff under different soil and water conservation measures on the slope orchard,xie,2014,,liu2021,xie2014
identifying response groups of soil nitrifiers and denitrifiers to grazing and associated soil environmental drivers in tibetan alpine meadows,xie,2014,10.1016/j.soilbio.2014.06.024,byrnes2018,xie2014
"effects of applying different kind fertilizers on enzyme activities related to carbon, nitrogen and phosphorus cycles in reddish paddy soil",xu,2013,,li2020,xu2013
soil organic carbon stocks as affected by tillage systems in a double-cropped rice field,xu,2013,10.1016/s1002-0160(13)60062-4,mondal2020,xu2013
evaluating the effect of tillage on carbon sequestration using the minimum detectable difference concept,yang,2008,10.1016/s1002-0160(08)60033-8,mondal2020,yang2008
impacts of long-term and recently imposed tillage practices on the vertical distribution of soil organic carbon,yang,2008,10.1016/j.still.2008.05.003,mondal2020,yang2008
hydrological and soil conservation effects of citrus garden in red soil slop,yang,2011,,liu2021,yang2011
"response of net photosynthetic rate in flowering and boll-forming stages, and cotton yield to irrigation and nitrogen fertilizer application",yang,2011,,cheng2021b,yang2011
arbuscular mycorrhizal fungal community structure and diversity in response to 3-year conservation tillage management in a sandy loam soil in north china,yang,2012,10.1007/s11368-012-0518-9,li2020,yang2012
"eco-hydrological characteristics and soil and water conservation effect of citrus plantation on slope red soil of jiangxi province, chinn",yang,2012,10.13287/j.1001-9332.2012.0058,liu2021,yang2012
"effects of partial root-zone irrigation on physiology, fruit yield and quality and water use efficiency of tomato under different calcium levels",yang,2012,10.1016/j.agwat.2011.12.001,cheng2021a,yang2012
effects of long-term no-tillage on soil structure and organic carbon distribution in different soil layers,yang,2017,,li2020,yang2017
improved water use efficiency and fruit quality of greenhouse crops under regulated deficit irrigation in northwest china,yang,2017,10.1016/j.agwat.2016.05.029,yu2021,yang2017
effect of water-nitrogen on cotton yield and root characteristics in different growth stage under mulching drip irrigation,yu,2015,,cheng2021b,yu2015
"impact of land-use changes on soil hydraulic properties of calcaric regosols on the loess plateau, nw china",yu,2015,10.1002/jpln.201400090,basche2017,yu2015
estimation of runoff mitigation by morphologically different cover crop root systems,yu,2016,10.1016/j.jhydrol.2016.04.060,meyer2019,yu2016
responses of corn physiology and yield to six agricultural practices over three years in middle tennessee,yu,2016,10.1038/srep27504,gao2020,yu2016
study of pummelo orchards grow grass on runoff soil physical and chemical properties and gis application,yuan,2017,,liu2021,yuan2017
the characteristics of biochar from halophyte plants and the amelioration effect and its mechanism on the salt-affected soil,yuan,2017,,islam2021,yuan2017
benefits of soil and water conservation measurement on orchard slope land of red soil,zhang,2001,10.13870/j.cnki.stbcxb.2001.02.028,liu2021,zhang2001
effect of vetivera zizanioides and amorpha fruticosa on soil and water conservation in yellow skoping upland areas of middle guizhou,zhang,2001,,xiong2018,zhang2001
effects of regulated deficit irrigation on grain yield and water use efficiency of spring wheat in an arid environment,zhang,2007,10.4141/p04-165,yu2020,zhang2007
relationship between soil structure and runoff/soil loss after 24 years of conservation tillage,zhang,2007,10.1016/j.still.2006.01.006,mhazo2016,zhang2007
"soil properties and barley yield under a twenty-years experiment of tillage, straw management and nitrogen application rate in the sub-arctic area of alaska",zhang,2007,10.1080/09064710601160110,mondal2020,zhang2007
effect of straw and plastic film management under contrasting tillage practices on the physical properties of an erodible loess soil,zhang,2008,10.1016/j.still.2007.09.001,mondal2020,zhang2008
experimental study on usle model in granite gneiss region of northern jiangsu province,zhang,2008,,xiong2018,zhang2008
analysis of the characteristics of nitrogen and phosphorus loss in orchards on red soil sloping land under different vegetation conditions,zhang,2010,cnki:sun:hhdx.0.2010-05-002,liu2021,zhang2010
"effect of biochar amendment on yield and methane and nitrous oxide emissions from a rice paddy from tai lake plain, china",zhang,2010,10.1016/j.agee.2010.09.003,omondi2016,zhang2010
soil nutrient contents and enzymatic characteristics as affected by 7-year no tillage under maize cropping in a meadow brown soil,zhang,2010,10.4067/s0718-27912010000200006,mondal2020,zhang2010
study on soil and water conservation effect under different inter-cropping for orchards on red soil slope land,zhang,2010,,liu2021,zhang2010
effects of planting forage grasses on eco-enviroment in a peach orchard,zhang,2011,,liu2021,zhang2011
